<?xml version="1.0" encoding="ISO-8859-1"?>
<!DOCTYPE TOUCHGRAPH_LB [

<!ELEMENT TOUCHGRAPH_LB (NODESET, EDGESET, PARAMETERS)>
<!ELEMENT NODESET (NODE+)>
<!ELEMENT EDGESET (EDGE*)>
<!ELEMENT PARAMETERS (PARAM*)>

<!ELEMENT NODE (NODE_LOCATION?, NODE_LABEL?, NODE_URL?, NODE_HINT?)>

<!ELEMENT NODE_LABEL EMPTY>
<!ELEMENT NODE_URL EMPTY>
<!ELEMENT NODE_HINT EMPTY>

<!ATTLIST TOUCHGRAPH_LB
  version CDATA #REQUIRED >

<!ATTLIST NODE
  nodeID CDATA #REQUIRED >

<!ATTLIST NODE_LOCATION
  visible CDATA #IMPLIED
  x CDATA #IMPLIED
  y CDATA #IMPLIED >

<!ATTLIST NODE_LABEL
  label CDATA #REQUIRED 
  shape CDATA #IMPLIED
  backColor CDATA #IMPLIED 
  textColor CDATA #IMPLIED
  fontSize CDATA #IMPLIED >

<!ATTLIST NODE_URL 
  url CDATA #REQUIRED 
  urlIsLocal CDATA #IMPLIED 
  urlIsXML CDATA #IMPLIED >

<!ATTLIST NODE_HINT 
  hint CDATA #REQUIRED 
  height CDATA #IMPLIED 
  width CDATA #IMPLIED 
  isHTML CDATA #IMPLIED >  

<!ELEMENT EDGE EMPTY>

<!ATTLIST EDGE
  fromID CDATA #REQUIRED
  toID CDATA #REQUIRED 
  length CDATA #IMPLIED 
  color CDATA #IMPLIED 
  type CDATA #IMPLIED
  visible CDATA #IMPLIED >

<!ELEMENT PARAM EMPTY>

<!ATTLIST PARAM
  name CDATA #REQUIRED
  value CDATA #REQUIRED >
]>
<TOUCHGRAPH_LB version="1.20">
    <NODESET>
        <NODE nodeID="pretend">
            <NODE_LOCATION x="0" y="0" visible="true"/>
            <NODE_LABEL label="pretend" shape="3" backColor="A04000" textColor="000000" fontSize="16"/>
        </NODE>
        <NODE nodeID="dragged">
            <NODE_LOCATION x="0" y="0" visible="true"/>
            <NODE_LABEL label="dragged" shape="3" backColor="A04000" textColor="000000" fontSize="16"/>
        </NODE>
        <NODE nodeID="fifty">
            <NODE_LOCATION x="0" y="0" visible="true"/>
            <NODE_LABEL label="fifty" shape="3" backColor="D00000" textColor="000000" fontSize="16"/>
        </NODE>
        <NODE nodeID="hate">
            <NODE_LOCATION x="0" y="0" visible="true"/>
            <NODE_LABEL label="hate" shape="3" backColor="FF00FF" textColor="000000" fontSize="16"/>
        </NODE>
        <NODE nodeID="toyota">
            <NODE_LOCATION x="0" y="0" visible="true"/>
            <NODE_LABEL label="toyota" shape="3" backColor="FF00FF" textColor="000000" fontSize="16"/>
        </NODE>
        <NODE nodeID="salem">
            <NODE_LOCATION x="0" y="0" visible="true"/>
            <NODE_LABEL label="salem" shape="3" backColor="0000E0" textColor="000000" fontSize="16"/>
        </NODE>
        <NODE nodeID="bleak">
            <NODE_LOCATION x="0" y="0" visible="true"/>
            <NODE_LABEL label="bleak" shape="3" backColor="D00000" textColor="000000" fontSize="16"/>
        </NODE>
        <NODE nodeID="casey">
            <NODE_LOCATION x="0" y="0" visible="true"/>
            <NODE_LABEL label="casey" shape="3" backColor="D00000" textColor="000000" fontSize="16"/>
        </NODE>
        <NODE nodeID="prefer">
            <NODE_LOCATION x="0" y="0" visible="true"/>
            <NODE_LABEL label="prefer" shape="3" backColor="D00000" textColor="000000" fontSize="16"/>
        </NODE>
        <NODE nodeID="caprices">
            <NODE_LOCATION x="0" y="0" visible="true"/>
            <NODE_LABEL label="caprices" shape="3" backColor="D00000" textColor="000000" fontSize="16"/>
        </NODE>
        <NODE nodeID="carlo">
            <NODE_LOCATION x="0" y="0" visible="true"/>
            <NODE_LABEL label="carlo" shape="3" backColor="D00000" textColor="000000" fontSize="16"/>
        </NODE>
        <NODE nodeID="simulator">
            <NODE_LOCATION x="0" y="0" visible="true"/>
            <NODE_LABEL label="simulator" shape="3" backColor="FF00FF" textColor="000000" fontSize="16"/>
        </NODE>
        <NODE nodeID="pump">
            <NODE_LOCATION x="0" y="0" visible="true"/>
            <NODE_LABEL label="pump" shape="3" backColor="FF00FF" textColor="000000" fontSize="16"/>
        </NODE>
        <NODE nodeID="spelled">
            <NODE_LOCATION x="0" y="0" visible="true"/>
            <NODE_LABEL label="spelled" shape="3" backColor="A04000" textColor="000000" fontSize="16"/>
        </NODE>
        <NODE nodeID="chuckled">
            <NODE_LOCATION x="0" y="0" visible="true"/>
            <NODE_LABEL label="chuckled" shape="3" backColor="D00000" textColor="000000" fontSize="16"/>
        </NODE>
        <NODE nodeID="preferred">
            <NODE_LOCATION x="0" y="0" visible="true"/>
            <NODE_LABEL label="preferred" shape="3" backColor="FF00FF" textColor="000000" fontSize="16"/>
        </NODE>
        <NODE nodeID="trivial">
            <NODE_LOCATION x="0" y="0" visible="true"/>
            <NODE_LABEL label="trivial" shape="3" backColor="FF00FF" textColor="000000" fontSize="16"/>
        </NODE>
        <NODE nodeID="mobility">
            <NODE_LOCATION x="0" y="0" visible="true"/>
            <NODE_LABEL label="mobility" shape="3" backColor="D00000" textColor="000000" fontSize="16"/>
        </NODE>
        <NODE nodeID="recorded">
            <NODE_LOCATION x="0" y="0" visible="true"/>
            <NODE_LABEL label="recorded" shape="3" backColor="A04000" textColor="000000" fontSize="16"/>
        </NODE>
        <NODE nodeID="introduction">
            <NODE_LOCATION x="0" y="0" visible="true"/>
            <NODE_LABEL label="introduction" shape="3" backColor="0000E0" textColor="000000" fontSize="16"/>
        </NODE>
        <NODE nodeID="hagerbaumer">
            <NODE_LOCATION x="0" y="0" visible="true"/>
            <NODE_LABEL label="hagerbaumer" shape="3" backColor="FF00FF" textColor="000000" fontSize="16"/>
        </NODE>
        <NODE nodeID="suvs">
            <NODE_LOCATION x="0" y="0" visible="true"/>
            <NODE_LABEL label="suvs" shape="3" backColor="A04000" textColor="000000" fontSize="16"/>
        </NODE>
        <NODE nodeID="sl">
            <NODE_LOCATION x="0" y="0" visible="true"/>
            <NODE_LABEL label="sl" shape="3" backColor="FF00FF" textColor="000000" fontSize="16"/>
        </NODE>
        <NODE nodeID="user">
            <NODE_LOCATION x="0" y="0" visible="true"/>
            <NODE_LABEL label="user" shape="3" backColor="FF00FF" textColor="000000" fontSize="16"/>
        </NODE>
        <NODE nodeID="panel&apos;s">
            <NODE_LOCATION x="0" y="0" visible="true"/>
            <NODE_LABEL label="panel&apos;s" shape="3" backColor="D00000" textColor="000000" fontSize="16"/>
        </NODE>
        <NODE nodeID="gallon">
            <NODE_LOCATION x="0" y="0" visible="true"/>
            <NODE_LABEL label="gallon" shape="3" backColor="0000E0" textColor="000000" fontSize="16"/>
        </NODE>
        <NODE nodeID="disrupting">
            <NODE_LOCATION x="0" y="0" visible="true"/>
            <NODE_LABEL label="disrupting" shape="3" backColor="FF00FF" textColor="000000" fontSize="16"/>
        </NODE>
        <NODE nodeID="data">
            <NODE_LOCATION x="0" y="0" visible="true"/>
            <NODE_LABEL label="data" shape="3" backColor="A04000" textColor="000000" fontSize="16"/>
        </NODE>
        <NODE nodeID="ready">
            <NODE_LOCATION x="0" y="0" visible="true"/>
            <NODE_LABEL label="ready" shape="3" backColor="A04000" textColor="000000" fontSize="16"/>
        </NODE>
        <NODE nodeID="crammed">
            <NODE_LOCATION x="0" y="0" visible="true"/>
            <NODE_LABEL label="crammed" shape="3" backColor="0000E0" textColor="000000" fontSize="16"/>
        </NODE>
        <NODE nodeID="tunnels">
            <NODE_LOCATION x="0" y="0" visible="true"/>
            <NODE_LABEL label="tunnels" shape="3" backColor="FF00FF" textColor="000000" fontSize="16"/>
        </NODE>
        <NODE nodeID="whitty">
            <NODE_LOCATION x="0" y="0" visible="true"/>
            <NODE_LABEL label="whitty" shape="3" backColor="A04000" textColor="000000" fontSize="16"/>
        </NODE>
        <NODE nodeID="efficiency">
            <NODE_LOCATION x="0" y="0" visible="true"/>
            <NODE_LABEL label="efficiency" shape="3" backColor="A04000" textColor="000000" fontSize="16"/>
        </NODE>
        <NODE nodeID="falling">
            <NODE_LOCATION x="0" y="0" visible="true"/>
            <NODE_LABEL label="falling" shape="3" backColor="FF00FF" textColor="000000" fontSize="16"/>
        </NODE>
        <NODE nodeID="eis">
            <NODE_LOCATION x="0" y="0" visible="true"/>
            <NODE_LABEL label="eis" shape="3" backColor="FF00FF" textColor="000000" fontSize="16"/>
        </NODE>
        <NODE nodeID="tear">
            <NODE_LOCATION x="0" y="0" visible="true"/>
            <NODE_LABEL label="tear" shape="3" backColor="D00000" textColor="000000" fontSize="16"/>
        </NODE>
        <NODE nodeID="travels">
            <NODE_LOCATION x="0" y="0" visible="true"/>
            <NODE_LABEL label="travels" shape="3" backColor="FF00FF" textColor="000000" fontSize="16"/>
        </NODE>
        <NODE nodeID="chairs">
            <NODE_LOCATION x="0" y="0" visible="true"/>
            <NODE_LABEL label="chairs" shape="3" backColor="FF00FF" textColor="000000" fontSize="16"/>
        </NODE>
        <NODE nodeID="inflict">
            <NODE_LOCATION x="0" y="0" visible="true"/>
            <NODE_LABEL label="inflict" shape="3" backColor="D00000" textColor="000000" fontSize="16"/>
        </NODE>
        <NODE nodeID="sifted">
            <NODE_LOCATION x="0" y="0" visible="true"/>
            <NODE_LABEL label="sifted" shape="3" backColor="D00000" textColor="000000" fontSize="16"/>
        </NODE>
        <NODE nodeID="patrol">
            <NODE_LOCATION x="0" y="0" visible="true"/>
            <NODE_LABEL label="patrol" shape="3" backColor="FF00FF" textColor="000000" fontSize="16"/>
        </NODE>
        <NODE nodeID="digging">
            <NODE_LOCATION x="0" y="0" visible="true"/>
            <NODE_LABEL label="digging" shape="3" backColor="FF00FF" textColor="000000" fontSize="16"/>
        </NODE>
        <NODE nodeID="averaged">
            <NODE_LOCATION x="0" y="0" visible="true"/>
            <NODE_LABEL label="averaged" shape="3" backColor="D00000" textColor="000000" fontSize="16"/>
        </NODE>
        <NODE nodeID="leo">
            <NODE_LOCATION x="0" y="0" visible="true"/>
            <NODE_LABEL label="leo" shape="3" backColor="D00000" textColor="000000" fontSize="16"/>
        </NODE>
        <NODE nodeID="uploaded">
            <NODE_LOCATION x="0" y="0" visible="true"/>
            <NODE_LABEL label="uploaded" shape="3" backColor="A04000" textColor="000000" fontSize="16"/>
        </NODE>
        <NODE nodeID="reduces">
            <NODE_LOCATION x="0" y="0" visible="true"/>
            <NODE_LABEL label="reduces" shape="3" backColor="FF00FF" textColor="000000" fontSize="16"/>
        </NODE>
        <NODE nodeID="license">
            <NODE_LOCATION x="0" y="0" visible="true"/>
            <NODE_LABEL label="license" shape="3" backColor="FF00FF" textColor="000000" fontSize="16"/>
        </NODE>
        <NODE nodeID="drink">
            <NODE_LOCATION x="0" y="0" visible="true"/>
            <NODE_LABEL label="drink" shape="3" backColor="D00000" textColor="000000" fontSize="16"/>
        </NODE>
        <NODE nodeID="regretting">
            <NODE_LOCATION x="0" y="0" visible="true"/>
            <NODE_LABEL label="regretting" shape="3" backColor="FF00FF" textColor="000000" fontSize="16"/>
        </NODE>
        <NODE nodeID="patterns">
            <NODE_LOCATION x="0" y="0" visible="true"/>
            <NODE_LABEL label="patterns" shape="3" backColor="FF00FF" textColor="000000" fontSize="16"/>
        </NODE>
        <NODE nodeID="cent">
            <NODE_LOCATION x="0" y="0" visible="true"/>
            <NODE_LABEL label="cent" shape="3" backColor="D00000" textColor="000000" fontSize="16"/>
        </NODE>
        <NODE nodeID="owning">
            <NODE_LOCATION x="0" y="0" visible="true"/>
            <NODE_LABEL label="owning" shape="3" backColor="A04000" textColor="000000" fontSize="16"/>
        </NODE>
        <NODE nodeID="acquire">
            <NODE_LOCATION x="0" y="0" visible="true"/>
            <NODE_LABEL label="acquire" shape="3" backColor="FF00FF" textColor="000000" fontSize="16"/>
        </NODE>
        <NODE nodeID="architect">
            <NODE_LOCATION x="0" y="0" visible="true"/>
            <NODE_LABEL label="architect" shape="3" backColor="FF00FF" textColor="000000" fontSize="16"/>
        </NODE>
        <NODE nodeID="convinced">
            <NODE_LOCATION x="0" y="0" visible="true"/>
            <NODE_LABEL label="convinced" shape="3" backColor="FF00FF" textColor="000000" fontSize="16"/>
        </NODE>
        <NODE nodeID="ore">
            <NODE_LOCATION x="0" y="0" visible="true"/>
            <NODE_LABEL label="ore" shape="3" backColor="D00000" textColor="000000" fontSize="16"/>
        </NODE>
        <NODE nodeID="inflation">
            <NODE_LOCATION x="0" y="0" visible="true"/>
            <NODE_LABEL label="inflation" shape="3" backColor="FF00FF" textColor="000000" fontSize="16"/>
        </NODE>
        <NODE nodeID="force&apos;s">
            <NODE_LOCATION x="0" y="0" visible="true"/>
            <NODE_LABEL label="force&apos;s" shape="3" backColor="A04000" textColor="000000" fontSize="16"/>
        </NODE>
        <NODE nodeID="ditching">
            <NODE_LOCATION x="0" y="0" visible="true"/>
            <NODE_LABEL label="ditching" shape="3" backColor="FF00FF" textColor="000000" fontSize="16"/>
        </NODE>
        <NODE nodeID="type">
            <NODE_LOCATION x="0" y="0" visible="true"/>
            <NODE_LABEL label="type" shape="3" backColor="D00000" textColor="000000" fontSize="16"/>
        </NODE>
        <NODE nodeID="brought">
            <NODE_LOCATION x="0" y="0" visible="true"/>
            <NODE_LABEL label="brought" shape="3" backColor="0000E0" textColor="000000" fontSize="16"/>
        </NODE>
        <NODE nodeID="underlying">
            <NODE_LOCATION x="0" y="0" visible="true"/>
            <NODE_LABEL label="underlying" shape="3" backColor="D00000" textColor="000000" fontSize="16"/>
        </NODE>
        <NODE nodeID="monte">
            <NODE_LOCATION x="0" y="0" visible="true"/>
            <NODE_LABEL label="monte" shape="3" backColor="D00000" textColor="000000" fontSize="16"/>
        </NODE>
        <NODE nodeID="bound">
            <NODE_LOCATION x="0" y="0" visible="true"/>
            <NODE_LABEL label="bound" shape="3" backColor="FF00FF" textColor="000000" fontSize="16"/>
        </NODE>
        <NODE nodeID="wand">
            <NODE_LOCATION x="0" y="0" visible="true"/>
            <NODE_LABEL label="wand" shape="3" backColor="A04000" textColor="000000" fontSize="16"/>
        </NODE>
        <NODE nodeID="kent">
            <NODE_LOCATION x="0" y="0" visible="true"/>
            <NODE_LABEL label="kent" shape="3" backColor="FF00FF" textColor="000000" fontSize="16"/>
        </NODE>
        <NODE nodeID="displayed">
            <NODE_LOCATION x="0" y="0" visible="true"/>
            <NODE_LABEL label="displayed" shape="3" backColor="FF00FF" textColor="000000" fontSize="16"/>
        </NODE>
        <NODE nodeID="adjusted">
            <NODE_LOCATION x="0" y="0" visible="true"/>
            <NODE_LABEL label="adjusted" shape="3" backColor="A04000" textColor="000000" fontSize="16"/>
        </NODE>
        <NODE nodeID="tax">
            <NODE_LOCATION x="0" y="0" visible="true"/>
            <NODE_LABEL label="tax" shape="3" backColor="A04000" textColor="000000" fontSize="16"/>
        </NODE>
        <NODE nodeID="malaise">
            <NODE_LOCATION x="0" y="0" visible="true"/>
            <NODE_LABEL label="malaise" shape="3" backColor="A04000" textColor="000000" fontSize="16"/>
        </NODE>
        <NODE nodeID="odometer">
            <NODE_LOCATION x="0" y="0" visible="true"/>
            <NODE_LABEL label="odometer" shape="3" backColor="D00000" textColor="000000" fontSize="16"/>
        </NODE>
        <NODE nodeID="impalas">
            <NODE_LOCATION x="0" y="0" visible="true"/>
            <NODE_LABEL label="impalas" shape="3" backColor="FF00FF" textColor="000000" fontSize="16"/>
        </NODE>
        <NODE nodeID="commutes">
            <NODE_LOCATION x="0" y="0" visible="true"/>
            <NODE_LABEL label="commutes" shape="3" backColor="FF00FF" textColor="000000" fontSize="16"/>
        </NODE>
        <NODE nodeID="patten">
            <NODE_LOCATION x="0" y="0" visible="true"/>
            <NODE_LABEL label="patten" shape="3" backColor="FF00FF" textColor="000000" fontSize="16"/>
        </NODE>
        <NODE nodeID="fattened">
            <NODE_LOCATION x="0" y="0" visible="true"/>
            <NODE_LABEL label="fattened" shape="3" backColor="FF00FF" textColor="000000" fontSize="16"/>
        </NODE>
        <NODE nodeID="mercury">
            <NODE_LOCATION x="0" y="0" visible="true"/>
            <NODE_LABEL label="mercury" shape="3" backColor="D00000" textColor="000000" fontSize="16"/>
        </NODE>
        <NODE nodeID="perspective">
            <NODE_LOCATION x="0" y="0" visible="true"/>
            <NODE_LABEL label="perspective" shape="3" backColor="D00000" textColor="000000" fontSize="16"/>
        </NODE>
        <NODE nodeID="ltds">
            <NODE_LOCATION x="0" y="0" visible="true"/>
            <NODE_LABEL label="ltds" shape="3" backColor="D00000" textColor="000000" fontSize="16"/>
        </NODE>
        <NODE nodeID="civics">
            <NODE_LOCATION x="0" y="0" visible="true"/>
            <NODE_LABEL label="civics" shape="3" backColor="FF00FF" textColor="000000" fontSize="16"/>
        </NODE>
        <NODE nodeID="fragmenting">
            <NODE_LOCATION x="0" y="0" visible="true"/>
            <NODE_LABEL label="fragmenting" shape="3" backColor="D00000" textColor="000000" fontSize="16"/>
        </NODE>
        <NODE nodeID="keycorp">
            <NODE_LOCATION x="0" y="0" visible="true"/>
            <NODE_LABEL label="keycorp" shape="3" backColor="FF00FF" textColor="000000" fontSize="16"/>
        </NODE>
        <NODE nodeID="honda">
            <NODE_LOCATION x="0" y="0" visible="true"/>
            <NODE_LABEL label="honda" shape="3" backColor="A04000" textColor="000000" fontSize="16"/>
        </NODE>
        <NODE nodeID="nationally">
            <NODE_LOCATION x="0" y="0" visible="true"/>
            <NODE_LABEL label="nationally" shape="3" backColor="A04000" textColor="000000" fontSize="16"/>
        </NODE>
        <NODE nodeID="researchers">
            <NODE_LOCATION x="0" y="0" visible="true"/>
            <NODE_LABEL label="researchers" shape="3" backColor="A04000" textColor="000000" fontSize="16"/>
        </NODE>
        <NODE nodeID="experiment">
            <NODE_LOCATION x="0" y="0" visible="true"/>
            <NODE_LABEL label="experiment" shape="3" backColor="D00000" textColor="000000" fontSize="16"/>
        </NODE>
        <NODE nodeID="km">
            <NODE_LOCATION x="0" y="0" visible="true"/>
            <NODE_LABEL label="km" shape="3" backColor="FF00FF" textColor="000000" fontSize="16"/>
        </NODE>
        <NODE nodeID="starr">
            <NODE_LOCATION x="0" y="0" visible="true"/>
            <NODE_LABEL label="starr" shape="3" backColor="D00000" textColor="000000" fontSize="16"/>
        </NODE>
        <NODE nodeID="escort">
            <NODE_LOCATION x="0" y="0" visible="true"/>
            <NODE_LABEL label="escort" shape="3" backColor="A04000" textColor="000000" fontSize="16"/>
        </NODE>
        <NODE nodeID="oil">
            <NODE_LOCATION x="0" y="0" visible="true"/>
            <NODE_LABEL label="oil" shape="3" backColor="D00000" textColor="000000" fontSize="16"/>
        </NODE>
        <NODE nodeID="timetable">
            <NODE_LOCATION x="0" y="0" visible="true"/>
            <NODE_LABEL label="timetable" shape="3" backColor="A04000" textColor="000000" fontSize="16"/>
        </NODE>
        <NODE nodeID="iran">
            <NODE_LOCATION x="0" y="0" visible="true"/>
            <NODE_LABEL label="iran" shape="3" backColor="D00000" textColor="000000" fontSize="16"/>
        </NODE>
        <NODE nodeID="rover">
            <NODE_LOCATION x="0" y="0" visible="true"/>
            <NODE_LABEL label="rover" shape="3" backColor="0000E0" textColor="000000" fontSize="16"/>
        </NODE>
        <NODE nodeID="oldsmobile">
            <NODE_LOCATION x="0" y="0" visible="true"/>
            <NODE_LABEL label="oldsmobile" shape="3" backColor="FF00FF" textColor="000000" fontSize="16"/>
        </NODE>
        <NODE nodeID="uptick">
            <NODE_LOCATION x="0" y="0" visible="true"/>
            <NODE_LABEL label="uptick" shape="3" backColor="FF00FF" textColor="000000" fontSize="16"/>
        </NODE>
        <NODE nodeID="fleet">
            <NODE_LOCATION x="0" y="0" visible="true"/>
            <NODE_LABEL label="fleet" shape="3" backColor="A04000" textColor="000000" fontSize="16"/>
        </NODE>
        <NODE nodeID="rig">
            <NODE_LOCATION x="0" y="0" visible="true"/>
            <NODE_LABEL label="rig" shape="3" backColor="FF00FF" textColor="000000" fontSize="16"/>
        </NODE>
        <NODE nodeID="sippers">
            <NODE_LOCATION x="0" y="0" visible="true"/>
            <NODE_LABEL label="sippers" shape="3" backColor="D00000" textColor="000000" fontSize="16"/>
        </NODE>
        <NODE nodeID="scenic">
            <NODE_LOCATION x="0" y="0" visible="true"/>
            <NODE_LABEL label="scenic" shape="3" backColor="FF00FF" textColor="000000" fontSize="16"/>
        </NODE>
        <NODE nodeID="pontiac">
            <NODE_LOCATION x="0" y="0" visible="true"/>
            <NODE_LABEL label="pontiac" shape="3" backColor="D00000" textColor="000000" fontSize="16"/>
        </NODE>
        <NODE nodeID="fbi&apos;s">
            <NODE_LOCATION x="0" y="0" visible="true"/>
            <NODE_LABEL label="fbi&apos;s" shape="3" backColor="FF00FF" textColor="000000" fontSize="16"/>
        </NODE>
        <NODE nodeID="surging">
            <NODE_LOCATION x="0" y="0" visible="true"/>
            <NODE_LABEL label="surging" shape="3" backColor="0000E0" textColor="000000" fontSize="16"/>
        </NODE>
        <NODE nodeID="accords">
            <NODE_LOCATION x="0" y="0" visible="true"/>
            <NODE_LABEL label="accords" shape="3" backColor="A04000" textColor="000000" fontSize="16"/>
        </NODE>
        <NODE nodeID="cutlass">
            <NODE_LOCATION x="0" y="0" visible="true"/>
            <NODE_LABEL label="cutlass" shape="3" backColor="FF00FF" textColor="000000" fontSize="16"/>
        </NODE>
        <NODE nodeID="waves">
            <NODE_LOCATION x="0" y="0" visible="true"/>
            <NODE_LABEL label="waves" shape="3" backColor="A04000" textColor="000000" fontSize="16"/>
        </NODE>
        <NODE nodeID="rabbit">
            <NODE_LOCATION x="0" y="0" visible="true"/>
            <NODE_LABEL label="rabbit" shape="3" backColor="D00000" textColor="000000" fontSize="16"/>
        </NODE>
        <NODE nodeID="devices">
            <NODE_LOCATION x="0" y="0" visible="true"/>
            <NODE_LABEL label="devices" shape="3" backColor="0000E0" textColor="000000" fontSize="16"/>
        </NODE>
        <NODE nodeID="rohrersville">
            <NODE_LOCATION x="0" y="0" visible="true"/>
            <NODE_LABEL label="rohrersville" shape="3" backColor="A04000" textColor="000000" fontSize="16"/>
        </NODE>
        <NODE nodeID="personalized">
            <NODE_LOCATION x="0" y="0" visible="true"/>
            <NODE_LABEL label="personalized" shape="3" backColor="D00000" textColor="000000" fontSize="16"/>
        </NODE>
        <NODE nodeID="contested">
            <NODE_LOCATION x="0" y="0" visible="true"/>
            <NODE_LABEL label="contested" shape="3" backColor="FF00FF" textColor="000000" fontSize="16"/>
        </NODE>
        <NODE nodeID="guggenheim">
            <NODE_LOCATION x="0" y="0" visible="true"/>
            <NODE_LABEL label="guggenheim" shape="3" backColor="A04000" textColor="000000" fontSize="16"/>
        </NODE>
        <NODE nodeID="broke">
            <NODE_LOCATION x="0" y="0" visible="true"/>
            <NODE_LABEL label="broke" shape="3" backColor="FF00FF" textColor="000000" fontSize="16"/>
        </NODE>
        <NODE nodeID="hybrid">
            <NODE_LOCATION x="0" y="0" visible="true"/>
            <NODE_LABEL label="hybrid" shape="3" backColor="FF00FF" textColor="000000" fontSize="16"/>
        </NODE>
        <NODE nodeID="moses">
            <NODE_LOCATION x="0" y="0" visible="true"/>
            <NODE_LABEL label="moses" shape="3" backColor="D00000" textColor="000000" fontSize="16"/>
        </NODE>
        <NODE nodeID="chase">
            <NODE_LOCATION x="0" y="0" visible="true"/>
            <NODE_LABEL label="chase" shape="3" backColor="FF00FF" textColor="000000" fontSize="16"/>
        </NODE>
        <NODE nodeID="brauns">
            <NODE_LOCATION x="0" y="0" visible="true"/>
            <NODE_LABEL label="brauns" shape="3" backColor="D00000" textColor="000000" fontSize="16"/>
        </NODE>
        <NODE nodeID="metropolis">
            <NODE_LOCATION x="0" y="0" visible="true"/>
            <NODE_LABEL label="metropolis" shape="3" backColor="FF00FF" textColor="000000" fontSize="16"/>
        </NODE>
        <NODE nodeID="pledge">
            <NODE_LOCATION x="0" y="0" visible="true"/>
            <NODE_LABEL label="pledge" shape="3" backColor="FF00FF" textColor="000000" fontSize="16"/>
        </NODE>
        <NODE nodeID="sends">
            <NODE_LOCATION x="0" y="0" visible="true"/>
            <NODE_LABEL label="sends" shape="3" backColor="FF00FF" textColor="000000" fontSize="16"/>
        </NODE>
        <NODE nodeID="plate">
            <NODE_LOCATION x="0" y="0" visible="true"/>
            <NODE_LABEL label="plate" shape="3" backColor="D00000" textColor="000000" fontSize="16"/>
        </NODE>
        <NODE nodeID="encounter">
            <NODE_LOCATION x="0" y="0" visible="true"/>
            <NODE_LABEL label="encounter" shape="3" backColor="D00000" textColor="000000" fontSize="16"/>
        </NODE>
        <NODE nodeID="md">
            <NODE_LOCATION x="0" y="0" visible="true"/>
            <NODE_LABEL label="md" shape="3" backColor="A04000" textColor="000000" fontSize="16"/>
        </NODE>
        <NODE nodeID="york&apos;s">
            <NODE_LOCATION x="0" y="0" visible="true"/>
            <NODE_LABEL label="york&apos;s" shape="3" backColor="A04000" textColor="000000" fontSize="16"/>
        </NODE>
        <NODE nodeID="transferred">
            <NODE_LOCATION x="0" y="0" visible="true"/>
            <NODE_LABEL label="transferred" shape="3" backColor="D00000" textColor="000000" fontSize="16"/>
        </NODE>
        <NODE nodeID="jeep">
            <NODE_LOCATION x="0" y="0" visible="true"/>
            <NODE_LABEL label="jeep" shape="3" backColor="A04000" textColor="000000" fontSize="16"/>
        </NODE>
        <NODE nodeID="subtracts">
            <NODE_LOCATION x="0" y="0" visible="true"/>
            <NODE_LABEL label="subtracts" shape="3" backColor="FF00FF" textColor="000000" fontSize="16"/>
        </NODE>
        <NODE nodeID="beartooth">
            <NODE_LOCATION x="0" y="0" visible="true"/>
            <NODE_LABEL label="beartooth" shape="3" backColor="FF00FF" textColor="000000" fontSize="16"/>
        </NODE>
        <NODE nodeID="miles">
            <NODE_LOCATION x="0" y="0" visible="true"/>
            <NODE_LABEL label="miles" shape="3" backColor="0000E0" textColor="000000" fontSize="16"/>
        </NODE>
        <NODE nodeID="punched">
            <NODE_LOCATION x="0" y="0" visible="true"/>
            <NODE_LABEL label="punched" shape="3" backColor="FF00FF" textColor="000000" fontSize="16"/>
        </NODE>
        <NODE nodeID="smoke">
            <NODE_LOCATION x="0" y="0" visible="true"/>
            <NODE_LABEL label="smoke" shape="3" backColor="D00000" textColor="000000" fontSize="16"/>
        </NODE>
        <NODE nodeID="haze">
            <NODE_LOCATION x="0" y="0" visible="true"/>
            <NODE_LABEL label="haze" shape="3" backColor="FF00FF" textColor="000000" fontSize="16"/>
        </NODE>
        <NODE nodeID="beetle">
            <NODE_LOCATION x="0" y="0" visible="true"/>
            <NODE_LABEL label="beetle" shape="3" backColor="D00000" textColor="000000" fontSize="16"/>
        </NODE>
        <NODE nodeID="berner">
            <NODE_LOCATION x="0" y="0" visible="true"/>
            <NODE_LABEL label="berner" shape="3" backColor="FF00FF" textColor="000000" fontSize="16"/>
        </NODE>
        <NODE nodeID="prius">
            <NODE_LOCATION x="0" y="0" visible="true"/>
            <NODE_LABEL label="prius" shape="3" backColor="FF00FF" textColor="000000" fontSize="16"/>
        </NODE>
        <NODE nodeID="shifted">
            <NODE_LOCATION x="0" y="0" visible="true"/>
            <NODE_LABEL label="shifted" shape="3" backColor="A04000" textColor="000000" fontSize="16"/>
        </NODE>
        <NODE nodeID="collections">
            <NODE_LOCATION x="0" y="0" visible="true"/>
            <NODE_LABEL label="collections" shape="3" backColor="D00000" textColor="000000" fontSize="16"/>
        </NODE>
        <NODE nodeID="folks">
            <NODE_LOCATION x="0" y="0" visible="true"/>
            <NODE_LABEL label="folks" shape="3" backColor="D00000" textColor="000000" fontSize="16"/>
        </NODE>
        <NODE nodeID="separately">
            <NODE_LOCATION x="0" y="0" visible="true"/>
            <NODE_LABEL label="separately" shape="3" backColor="A04000" textColor="000000" fontSize="16"/>
        </NODE>
        <NODE nodeID="pacer">
            <NODE_LOCATION x="0" y="0" visible="true"/>
            <NODE_LABEL label="pacer" shape="3" backColor="FF00FF" textColor="000000" fontSize="16"/>
        </NODE>
        <NODE nodeID="corvallis">